{
  "protocol_version": 1,
  "operation": "execute",
  "attempt_id": "attempt-000001",
  "accepted_request": {
    "protocol_version": 1,
    "request_id": "req-000001",
    "request_digest": "365ec86ddd5cda3e9b6cb5771581ed742ff7d03829267ec6be3aef31a32da167",
    "request": {
      "protocol_version": 1,
      "request_id": "req-000001",
      "session_id": "example-session",
      "actor": "codex",
      "operation": "execute",
      "process_id": "",
      "shell": "pwsh",
      "working_directory": "C:\\Users\\Alice\\Projects\\demo",
      "script": "Get-ChildItem\n",
      "timeout_seconds": 900,
      "max_output_bytes": 1048576,
      "artifacts": [
        {
          "name": "test-results",
          "paths": ["test-results/**/*.png"]
        }
      ]
    },
    "issue": {
      "number": 42,
      "node_id": "ISSUE_node_42",
      "sender_id": 1001,
      "sender_login": "alice-example"
    },
    "workflow": {
      "repository": "alice/example-control",
      "run_id": 9001,
      "run_attempt": 1,
      "event_name": "issues",
      "event_action": "opened",
      "head_sha": "aaaaaaaaaaaaaaaaaaaaaaaaaaaaaaaaaaaaaaaa"
    },
    "control_source_sha": "bbbbbbbbbbbbbbbbbbbbbbbbbbbbbbbbbbbbbbbb",
    "accepted_at": "2026-09-02T18:00:00Z"
  }
}
